12:00:01.123456 IP 1.1.1.1.40000 > 2.2.2.1.80: Flags [S], seq 123456789, win 65535, length 0    
12:00:01.223456 IP 2.2.2.1.80 > 1.1.1.1.40000: Flags [S.], seq 987654321, ack 123456790, win 65535, length 0  
12:00:01.323456 IP 1.1.1.1.40000 > 2.2.2.1.80: Flags [.], ack 987654322, win 65535, length 0 
12:00:01.423456 IP 1.1.1.1.40000 > 2.2.2.1.80: Flags [P.], seq 123456790:123456890, ack 987654322, win 65535, length 100:HTTP: GET /index.html HTTP/1.1
12:00:01.523456 IP 2.2.2.1.80 > 1.1.1.1.40000: Flags [P.], seq 987654322:987654422, ack 123456890, win 65535, length 100:HTTP: HTTP/1.1 200 OK
12:00:01.523457 IP 2.2.2.1.454 > 1.1.1.1.40000: Flags [P.], seq 987654322:987654422, ack 123456890, win 65535, length 100:HTTP: HTTP/1.1 200 OK 
12:00:01.723456 IP 1.1.1.1.5 > 2.2.2.1: ICMP echo request, id 100, seq 1, length 64
12:00:01.723457 IP 1.1.1.1 > 2.2.2.1: ICMP echo request, id 100, seq 1, length 64
12:00:01.823456 IP 2.2.564.1 > 1.1.1.1: ICMP echo reply, id -100, seq 1, length 64  
12:00:01.923456 IP 1.1.1.1.50000 > 2.2.2.1.53: UDP, length 128  
12:00:02.023457 IP 2.2.2.1.53 > 1.1.1.1.50000: ICMP, length 128  
12:00:02.023458 IP 2.2.2.1.53 > 1.1.1.1.3: UDP, length 128 
12:00:02.123456 IP 10.0.0.1.10000 > 2.2.2.2.443: Flags [S], seq 111111111, win 65535, length 0  
12:00:02.123457 IP 10.0.0.2.10001 > 2.2.2.2.443: Flags [S], seq 222222222, win 65535, length 0  
12:00:02.123458 IP 10.0.0.3.10002 > 2.2.2.2.443: Flags [S], seq 333333333, win 65535, length 0  
12:00:02.123459 IP 10.0.0.4.10003 > 2.2.2.2.443: Flags [S], seq 444444444, win 65535, length 0  
12:00:02.123460 IP 10.0.0.5.10004 > 2.2.2.2.443: Flags [S], seq 555555555, win 65535, length 0 
12:00:01.123456 IP 1.1.1.1.50000 > 2.2.2.1.80: Flags [S], seq 123456789, win 65535, length 0    
12:00:01.223456 IP 2.2.2.1.80 > 1.1.1.1.50000: Flags [S.], seq 987654321, ack 123456790, win 65535, length 0  
